{
  "$ref": "#/definitions/snippets",
  "definitions": {
    "snippets": {
      "type": "object",
      "properties": {
        "id": {
          "type": "number"
        },
        "title": {
          "type": "string"
        },
        "tags": {
          "type": "array",
          "items": {
            "type": "object",
            "properties": {
              "libelle": {
                "type": "string"
              },
              "color": {
                "type": "string"
              }
            },
            "required": [
              "libelle",
              "color"
            ],
            "additionalProperties": false
          }
        },
        "code": {
          "type": "string"
        },
        "lang": {
          "type": "string",
          "enum": [
            "typescript",
            "javascript"
          ]
        },
        "$schema": {
          "type": "string"
        }
      },
      "required": [
        "id",
        "title",
        "tags",
        "code",
        "lang"
      ],
      "additionalProperties": false
    }
  },
  "$schema": "http://json-schema.org/draft-07/schema#"
}